{
 "id": "Q6627747",
 "sources": {
  "wikipedia": {
   "title": "אבא דוד גולדפיין",
   "url": "https://he.wikipedia.org/wiki/%D7%90%D7%91%D7%90_%D7%93%D7%95%D7%93_%D7%92%D7%95%D7%9C%D7%93%D7%A4%D7%99%D7%99%D7%9F",
   "revid": 43618259,
   "retrieved": "2026-10-04",
   "raw": "data/raw/wikipedia/Q6627747.wikitext",
   "credit": "wikipedia"
  },
  "wikidata": {
   "id": "Q6627747",
   "url": "https://www.wikidata.org/wiki/Q6627747",
   "retrieved": "2026-10-04",
   "raw": "data/raw/wikidata/Q6627747.json",
   "credit": "wikidata"
  }
 },
 "era": {
  "value": "acharonei_zmanenu",
  "src": [
   "editorial"
  ]
 },
 "fields": {
  "name": {
   "value": "רבי אבא דוד גולדפיין",
   "src": [
    "wikipedia"
   ]
  },
  "known_as": [
   {
    "value": "העילוי מאוטיאן",
    "src": [
     "wikipedia"
    ]
   }
  ],
  "honorific": {
   "value": "זצ\"ל",
   "src": [
    "editorial"
   ]
  },
  "generation": null,
  "region": [
   {
    "value": "ליטא",
    "src": [
     "wikipedia"
    ]
   },
   {
    "value": "רוסיה",
    "src": [
     "wikipedia"
    ]
   }
  ],
  "born": {
   "hebrew": {
    "value": "ה'תרל\"ד",
    "src": [
     "wikipedia"
    ]
   },
   "gregorian": null,
   "place": {
    "value": "בראדייק שבמחוז קובנה",
    "src": [
     "wikipedia"
    ]
   }
  },
  "died": {
   "hebrew": {
    "value": "י\"ט באייר ה'תרצ\"ו",
    "src": [
     "wikipedia"
    ]
   },
   "gregorian": {
    "value": "1936",
    "src": [
     "wikipedia",
     "wikidata"
    ]
   },
   "place": null
  },
  "buried": null,
  "roles": [
   {
    "value": "רב בית כנסת בדווינסק",
    "src": [
     "wikipedia"
    ]
   },
   {
    "value": "רבה הראשי של מוסקבה",
    "src": [
     "wikipedia",
     "wikidata"
    ]
   }
  ],
  "teachers": [
   {
    "value": "רבי חיים סולובייצ'יק (בישיבת וולוז'ין)",
    "src": [
     "wikipedia"
    ],
    "ref": "Q2637350"
   }
  ],
  "students": [
   {
    "value": "הרב משה צבי נריה",
    "src": [
     "wikipedia"
    ],
    "ref": "Q2910391"
   },
   {
    "value": "הרב דוד חנזין",
    "src": [
     "wikipedia"
    ]
   }
  ],
  "family": [
   {
    "value": {
     "relation": "אביו",
     "name": "יהודה גולדפיין"
    },
    "src": [
     "wikipedia"
    ]
   },
   {
    "value": {
     "relation": "חותנו",
     "name": "רבי יוסף רוזין, הגאון מרוגוטשוב"
    },
    "src": [
     "wikipedia"
    ],
    "ref": "Q2910297"
   }
  ],
  "works": [
   {
    "value": {
     "title": "קונטרס אחרון",
     "description": "חידושי תורה שנדפסו בספר \"צפנת פענח\" של חותנו"
    },
    "src": [
     "wikipedia"
    ]
   },
   {
    "value": {
     "title": "פתח בית דוד",
     "description": "חידושים על הרמב\"ם, בכתב יד"
    },
    "src": [
     "wikipedia"
    ]
   }
  ],
  "mentioned_in": null,
  "summary": {
   "value": "למד בישיבות וולוז'ין וסלבודקה, ובוולוז'ין התקרב לראש הישיבה רבי חיים סולובייצ'יק. נעשה חתנו של הגאון מרוגוטשוב, כיהן כרב בית כנסת בדווינסק, ובשנת תרע\"ה עבר למוסקבה ונתמנה זמן קצר אחר כך לרב העיר. תלמידיו העידו שידע בעל פה את התלמוד הבבלי והירושלמי ואת משנה תורה עם המשנה למלך.",
   "src": [
    "wikipedia"
   ]
  },
  "remember": {
   "value": "מסופר שבשעה ששמע שיעור מפי הגאון מרוגוטשוב בדווינסק הקשה קושיות חזקות, ומיד אחר השיעור הציע לו הגאון את בתו לאשה.",
   "src": [
    "wikipedia"
   ]
  }
 },
 "review": {
  "status": "draft",
  "flags": [],
  "written": "2026-10-05"
 }
}
