{
 "id": "Q5353639",
 "sources": {
  "wikipedia": {
   "title": "אלעזר מרדכי קניג",
   "url": "https://he.wikipedia.org/wiki/%D7%90%D7%9C%D7%A2%D7%96%D7%A8_%D7%9E%D7%A8%D7%93%D7%9B%D7%99_%D7%A7%D7%A0%D7%99%D7%92",
   "revid": 41795345,
   "retrieved": "2026-10-04",
   "raw": "data/raw/wikipedia/Q5353639.wikitext",
   "credit": "wikipedia"
  },
  "wikidata": {
   "id": "Q5353639",
   "url": "https://www.wikidata.org/wiki/Q5353639",
   "retrieved": "2026-10-04",
   "raw": "data/raw/wikidata/Q5353639.json",
   "credit": "wikidata"
  }
 },
 "era": {
  "value": "acharonei_zmanenu",
  "src": [
   "editorial"
  ]
 },
 "fields": {
  "name": {
   "value": "הרב אלעזר מרדכי קניג",
   "src": [
    "wikipedia",
    "wikidata"
   ]
  },
  "known_as": [],
  "honorific": {
   "value": "זצ\"ל",
   "src": [
    "editorial"
   ]
  },
  "generation": null,
  "region": [
   {
    "value": "ארץ ישראל",
    "src": [
     "wikipedia"
    ]
   }
  ],
  "born": {
   "hebrew": {
    "value": "ח' בחשוון ה'תש\"ו",
    "src": [
     "wikipedia"
    ]
   },
   "gregorian": {
    "value": "1945",
    "src": [
     "wikipedia",
     "wikidata"
    ]
   },
   "place": {
    "value": "ירושלים",
    "src": [
     "wikipedia",
     "wikidata"
    ]
   }
  },
  "died": {
   "hebrew": {
    "value": "כ\"ג בטבת ה'תשע\"ט",
    "src": [
     "wikipedia"
    ]
   },
   "gregorian": {
    "value": "2018",
    "src": [
     "wikipedia",
     "wikidata"
    ]
   },
   "place": {
    "value": "צפת",
    "src": [
     "wikidata"
    ]
   }
  },
  "buried": {
   "value": "בית העלמין החדש בצפת",
   "src": [
    "wikipedia"
   ],
   "alt": [
    {
     "value": "בית הקברות העתיק בצפת",
     "src": [
      "wikidata"
     ]
    }
   ]
  },
  "roles": [
   {
    "value": "רב קהילת חסידי ברסלב בצפת",
    "src": [
     "wikipedia"
    ]
   }
  ],
  "teachers": [
   {
    "value": "אביו הרב גדליהו אהרן קניג",
    "src": [
     "wikipedia"
    ],
    "ref": "Q5529643"
   },
   {
    "value": "הרב שלמה קצין",
    "src": [
     "wikipedia"
    ],
    "ref": "Q41957713"
   },
   {
    "value": "הרב מרדכי שרעבי",
    "src": [
     "wikipedia"
    ],
    "ref": "Q6909679"
   }
  ],
  "students": [],
  "family": [
   {
    "value": {
     "relation": "אביו",
     "name": "הרב גדליהו אהרן קניג, מגדולי תלמידי ר' אברהם שטרנהרץ"
    },
    "src": [
     "wikipedia"
    ],
    "ref": "Q5529643"
   },
   {
    "value": {
     "relation": "אחיו",
     "name": "הרב נתן אפרים קניג, ממשיכו בהנהגת הקהילה"
    },
    "src": [
     "wikipedia"
    ]
   }
  ],
  "works": [
   {
    "value": {
     "title": "פירוש על \"מעשה מביטחון\"",
     "description": "ביאור על אחד מסיפורי רבי נחמן מברסלב"
    },
    "src": [
     "wikipedia"
    ]
   },
   {
    "value": {
     "title": "שערי צדיק",
     "description": "סדרת מכתבי אביו, שהוציא לאור"
    },
    "src": [
     "wikipedia"
    ]
   }
  ],
  "mentioned_in": null,
  "summary": {
   "value": "מנהיג רוחני בחסידות ברסלב ורב קהילת ברסלב בצפת. נולד בירושלים, למד בישיבת ברסלב בבני ברק ובישיבת מיר, ולמד קבלה אצל הרב שלמה קצין והרב מרדכי שרעבי. לאחר פטירת אביו בשנת 1980 קבע את מושבו בצפת והמשיך את מפעלו להקמת מרכז תורני בעיר, וסביבו נתגבשה קהילה חסידית שקירבה מאות בעלי תשובה. הקפיד למסור את תורת רבי נחמן כפי שקיבלה מאביו, ללא שינוי.",
   "src": [
    "wikipedia"
   ]
  },
  "remember": {
   "value": "בכל סעודה שלישית מסר שיעור קבוע בליקוטי מוהר\"ן, על סדר הזמנים שבהם נאמרו התורות, במחזור של תשע שנים.",
   "src": [
    "wikipedia"
   ]
  }
 },
 "review": {
  "status": "draft",
  "flags": [
   "מקום הקבורה: במאמר 'בית העלמין החדש בצפת', בוויקינתונים 'בית הקברות העתיק בצפת' - נבחר נוסח המאמר.",
   "הושמטו פרקי הפולמוסים שבמאמר."
  ],
  "written": "2026-10-05"
 }
}
