{
 "id": "Q6119530",
 "sources": {
  "wikipedia": {
   "title": "יעקב בכרך",
   "url": "https://he.wikipedia.org/wiki/%D7%99%D7%A2%D7%A7%D7%91_%D7%91%D7%9B%D7%A8%D7%9A",
   "revid": 42339264,
   "retrieved": "2026-10-04",
   "raw": "data/raw/wikipedia/Q6119530.wikitext",
   "credit": "wikipedia"
  },
  "wikidata": {
   "id": "Q6119530",
   "url": "https://www.wikidata.org/wiki/Q6119530",
   "retrieved": "2026-10-04",
   "raw": "data/raw/wikidata/Q6119530.json",
   "credit": "wikidata"
  }
 },
 "era": {
  "value": "acharonim",
  "src": [
   "editorial"
  ]
 },
 "fields": {
  "name": {
   "value": "רבי יעקב בכרך",
   "src": [
    "wikipedia",
    "wikidata"
   ]
  },
  "known_as": [],
  "honorific": {
   "value": "זצ\"ל",
   "src": [
    "editorial"
   ]
  },
  "generation": null,
  "region": [
   {
    "value": "פולין-ליטא",
    "src": [
     "editorial"
    ]
   }
  ],
  "born": {
   "hebrew": {
    "value": "י\"א באייר ה'תקפ\"ד",
    "src": [
     "wikipedia"
    ]
   },
   "gregorian": {
    "value": "1824",
    "src": [
     "wikipedia",
     "wikidata"
    ]
   },
   "place": {
    "value": "סייני",
    "src": [
     "wikipedia",
     "wikidata"
    ]
   }
  },
  "died": {
   "hebrew": {
    "value": "כ\"ד בטבת ה'תרנ\"ז",
    "src": [
     "wikipedia"
    ]
   },
   "gregorian": {
    "value": "1896",
    "src": [
     "wikipedia",
     "wikidata"
    ]
   },
   "place": {
    "value": "ביאליסטוק",
    "src": [
     "wikipedia",
     "wikidata"
    ]
   }
  },
  "buried": {
   "value": "ביאליסטוק",
   "src": [
    "wikipedia"
   ]
  },
  "roles": [
   {
    "value": "מזכירו של רבי שמואל מוהליבר בביאליסטוק",
    "src": [
     "wikipedia"
    ]
   },
   {
    "value": "מנהל המחלקה העברית בבית הדפוס בקניגסברג",
    "src": [
     "wikipedia"
    ]
   }
  ],
  "teachers": [
   {
    "value": "סבו רבי יהודה בכרך, רבה של סייני",
    "src": [
     "wikipedia"
    ]
   }
  ],
  "students": [],
  "family": [
   {
    "value": {
     "relation": "אביו",
     "name": "משה בכרך"
    },
    "src": [
     "wikipedia"
    ],
    "ref": "Q25491416"
   },
   {
    "value": {
     "relation": "סבו",
     "name": "רבי יהודה בכרך, רבה של סייני"
    },
    "src": [
     "wikipedia"
    ]
   }
  ],
  "works": [
   {
    "value": {
     "title": "הגהות על ארבעה טורים",
     "description": "הגהות על הטור, שנדפסו במהדורת קניגסברג"
    },
    "src": [
     "wikipedia"
    ]
   },
   {
    "value": {
     "title": "מהעבור ומנין השנים",
     "description": "בירורים בעניין עיבור השנים והלוח העברי בימי קדם"
    },
    "src": [
     "wikipedia"
    ]
   },
   {
    "value": {
     "title": "אשתדלות עם שד\"ל",
     "description": "בירור קדמות הניקוד וטעמי המקרא"
    },
    "src": [
     "wikipedia"
    ]
   }
  ],
  "mentioned_in": null,
  "summary": {
   "value": "למדן מופלג, שגדל לצד סבו רבה של סייני ושימש לו תלמיד ועוזר. נמנה עם מקורביהם של רבי ישראל מסלנט ורבי יוסף דוב סולובייצ'יק, והביא בכתביו מדבריהם שבעל פה. נודע בעיקר בהגהותיו על ארבעה טורים, וחיבר סדרת ספרים בענייני הכתב האשורי, עיבור השנים וקדמות הניקוד והטעמים.",
   "src": [
    "wikipedia"
   ]
  },
  "remember": {
   "value": "אף שהוצעו לו משרות רבנות לאחר נישואיו, סירב להן.",
   "src": [
    "wikipedia"
   ]
  }
 },
 "review": {
  "status": "draft",
  "flags": [
   "האזור (פולין-ליטא) והתקופה נקבעו עריכתית לפי מקומות חייו.",
   "המאמר מתאר אותו 'למדן וחוקר תורני'; הושמטה מעורבותו בחובבי ציון."
  ],
  "written": "2026-10-05"
 }
}
