{
 "id": "Q7171317",
 "sources": {
  "wikipedia": {
   "title": "פסח שטיין",
   "url": "https://he.wikipedia.org/wiki/%D7%A4%D7%A1%D7%97_%D7%A9%D7%98%D7%99%D7%99%D7%9F",
   "revid": 43571696,
   "retrieved": "2026-10-04",
   "raw": "data/raw/wikipedia/Q7171317.wikitext",
   "credit": "wikipedia"
  },
  "wikidata": {
   "id": "Q7171317",
   "url": "https://www.wikidata.org/wiki/Q7171317",
   "retrieved": "2026-10-04",
   "raw": "data/raw/wikidata/Q7171317.json",
   "credit": "wikidata"
  }
 },
 "era": {
  "value": "acharonei_zmanenu",
  "src": [
   "editorial"
  ]
 },
 "fields": {
  "name": {
   "value": "הגאון רבי פסח יצחק שטיין",
   "src": [
    "wikipedia"
   ]
  },
  "known_as": [],
  "honorific": {
   "value": "זצ\"ל",
   "src": [
    "editorial"
   ]
  },
  "generation": null,
  "region": [
   {
    "value": "ארצות הברית",
    "src": [
     "wikipedia"
    ]
   }
  ],
  "born": {
   "hebrew": {
    "value": "אדר ה'תרע\"ח",
    "src": [
     "wikipedia"
    ]
   },
   "gregorian": {
    "value": "1918",
    "src": [
     "wikipedia",
     "wikidata"
    ]
   },
   "place": {
    "value": "בריינסק",
    "src": [
     "wikipedia"
    ],
    "alt": [
     {
      "value": "בראנסק",
      "src": [
       "wikidata"
      ]
     }
    ]
   }
  },
  "died": {
   "hebrew": {
    "value": "כ\"ח באייר ה'תשס\"ב",
    "src": [
     "wikipedia"
    ]
   },
   "gregorian": {
    "value": "2002",
    "src": [
     "wikipedia",
     "wikidata"
    ]
   },
   "place": {
    "value": "קליבלנד",
    "src": [
     "wikipedia",
     "wikidata"
    ]
   }
  },
  "buried": {
   "value": "הר הזיתים",
   "src": [
    "wikipedia",
    "wikidata"
   ]
  },
  "roles": [
   {
    "value": "ראש ישיבת טלז בקליבלנד",
    "src": [
     "wikipedia",
     "wikidata"
    ]
   }
  ],
  "teachers": [
   {
    "value": "רבי שבתי יגל",
    "src": [
     "wikipedia"
    ]
   },
   {
    "value": "רבי אליעזר יהודה פינקל",
    "src": [
     "wikipedia"
    ],
    "ref": "Q5360785"
   }
  ],
  "students": [],
  "family": [
   {
    "value": {
     "relation": "אביו",
     "name": "רבי אהרן שמואל שטיין, אב\"ד בריינסק ותלמיד רבי שמעון שקופ"
    },
    "src": [
     "wikipedia"
    ]
   },
   {
    "value": {
     "relation": "חותנו",
     "name": "רבי זלמן שמואל בלוך, המנהל הרוחני של ישיבת טלז"
    },
    "src": [
     "wikipedia"
    ]
   },
   {
    "value": {
     "relation": "בנו",
     "name": "רבי שמואל זלמן שטיין, בעל \"פרי שמואל\""
    },
    "src": [
     "wikipedia"
    ]
   },
   {
    "value": {
     "relation": "בנו",
     "name": "רבי אהרן שטיין, ראש ישיבת אור המאיר"
    },
    "src": [
     "wikipedia"
    ]
   }
  ],
  "works": [
   {
    "value": {
     "title": "ליקוטי שיעורים",
     "description": "שיעורים, בירורים והערות על הש\"ס"
    },
    "src": [
     "wikipedia"
    ]
   },
   {
    "value": {
     "title": "קונטרס המועדים",
     "description": "בירורים וביאורים בענייני המועדים"
    },
    "src": [
     "wikipedia"
    ]
   }
  ],
  "mentioned_in": null,
  "summary": {
   "value": "ראש ישיבת טלז בקליבלנד. למד בצעירותו בישיבת סלונים ואחר כך בישיבת מיר אצל רבי אליעזר יהודה פינקל, ויצא עם בני הישיבה לגלות שאנגחאי ומשם לארצות הברית. לאחר נישואיו עם בת רבי זלמן שמואל בלוך הצטרף לישיבת טלז, החל למסור בה שיעורים בקביעות, ובשנת ה'תשכ\"ה מונה לראש ישיבה. בשיעוריו שמר על דרך הלימוד של ישיבת מיר, בדקדוק בלשון רש\"י והוצאת גדרים למדניים ממנה.",
   "src": [
    "wikipedia"
   ]
  },
  "remember": {
   "value": "בברית המילה שלו שימש רבי שמעון שקופ כסנדק.",
   "src": [
    "wikipedia"
   ]
  }
 },
 "review": {
  "status": "draft",
  "flags": [
   "מקום הלידה: במאמר 'בריינסק', בוויקינתונים 'בראנסק'.",
   "הוא היה היחיד ממשפחתו ששרד את השואה; לא הובאו פרטים."
  ],
  "written": "2026-10-06"
 }
}
