{
 "id": "tta-333435",
 "sources": {
  "toldot_tannaim": {
   "pages": [
    {
     "title": "תולדות תנאים ואמוראים/א/רב אויא",
     "url": "https://he.wikisource.org/wiki/%D7%AA%D7%95%D7%9C%D7%93%D7%95%D7%AA_%D7%AA%D7%A0%D7%90%D7%99%D7%9D_%D7%95%D7%90%D7%9E%D7%95%D7%A8%D7%90%D7%99%D7%9D%2F%D7%90%2F%D7%A8%D7%91_%D7%90%D7%95%D7%99%D7%90",
     "revid": 764585,
     "raw": "data/raw/toldot_tannaim/scans.json"
    }
   ],
   "credit": "toldot_tannaim"
  }
 },
 "era": {
  "value": "amoraim",
  "src": [
   "editorial"
  ]
 },
 "fields": {
  "name": {
   "value": "רב אויא",
   "src": [
    "toldot_tannaim"
   ]
  },
  "known_as": [],
  "honorific": null,
  "generation": {
   "value": "אמורא בבל, מתלמידי רב יוסף",
   "src": [
    "toldot_tannaim"
   ]
  },
  "region": [
   {
    "value": "בבל",
    "src": [
     "toldot_tannaim"
    ]
   },
   {
    "value": "ארץ ישראל",
    "src": [
     "toldot_tannaim"
    ]
   }
  ],
  "born": {
   "hebrew": null,
   "gregorian": null,
   "place": null
  },
  "died": {
   "hebrew": null,
   "gregorian": null,
   "place": null
  },
  "buried": null,
  "roles": [],
  "teachers": [
   {
    "value": "רב יוסף",
    "src": [
     "toldot_tannaim"
    ]
   },
   {
    "value": "רבי אמי",
    "src": [
     "toldot_tannaim"
    ]
   }
  ],
  "students": [],
  "family": [
   {
    "value": {
     "relation": "גיסו",
     "name": "רמי בר פפא"
    },
    "src": [
     "toldot_tannaim"
    ]
   },
   {
    "value": {
     "relation": "בנו",
     "name": "רב אדא בריה דרב אויא"
    },
    "src": [
     "toldot_tannaim"
    ]
   },
   {
    "value": {
     "relation": "בנו",
     "name": "רב חלקיה בריה דרב אויא"
    },
    "src": [
     "toldot_tannaim"
    ]
   },
   {
    "value": {
     "relation": "בנו",
     "name": "רב אחא בריה דרב אויא"
    },
    "src": [
     "toldot_tannaim"
    ]
   }
  ],
  "works": [],
  "mentioned_in": null,
  "summary": {
   "value": "אמורא מבבל, תלמידו של רב יוסף, שהיה יושב לפניו ואומר שמועות משמו, וחבירו של רבה בר רב חנן. כנראה עלה לזמן קצר לארץ ישראל ולמד לפני רבי אמי בקיסרין ושאל לפני רבי אבהו, ואחר כך חזר לבבל. מאמריו מובאים בכמה מקומות בש\"ס.",
   "src": [
    "toldot_tannaim"
   ]
  },
  "remember": {
   "value": "פעם בא לבית רבא ושאלו רבא שאלות לנסותו, והשיב על כולן כהלכה, ואמר רב נחמן בר יצחק: \"בריך רחמנא דלא כסיפיה רבא\" (שבת מו.).",
   "src": [
    "toldot_tannaim"
   ]
  }
 },
 "review": {
  "status": "draft",
  "flags": [
   "התקופה (אמוראים) נקבעה לפי היותו תלמיד רב יוסף; הדף אינו אומר 'אמורא' במפורש.",
   "עלייתו לארץ ישראל וחזרתו לבבל מובאות בדף כהשערה ('כפי הנראה'); נכתב בסיכום בלשון 'כנראה'.",
   "גיסו: בב\"ב ק: אשתו אחות רמי בר פפא, ובכתובות נו: אחות רמי בר חמא (הדף משער שיש שיבוש); נבחר רמי בר פפא.",
   "בבנים לא נכללו רב הונא בר אויא והונא מר בר אויא, שהדף מזכירם בלי לומר במפורש שהם בניו."
  ],
  "written": "2026-10-22"
 }
}
