{
 "id": "tta-1709768",
 "sources": {
  "toldot_tannaim": {
   "pages": [
    {
     "title": "תולדות תנאים ואמוראים/ר/רבא בר משרשיא",
     "url": "https://he.wikisource.org/wiki/%D7%AA%D7%95%D7%9C%D7%93%D7%95%D7%AA_%D7%AA%D7%A0%D7%90%D7%99%D7%9D_%D7%95%D7%90%D7%9E%D7%95%D7%A8%D7%90%D7%99%D7%9D%2F%D7%A8%2F%D7%A8%D7%91%D7%90_%D7%91%D7%A8_%D7%9E%D7%A9%D7%A8%D7%A9%D7%99%D7%90",
     "revid": 2807056,
     "raw": "data/raw/toldot_tannaim/scans.json"
    }
   ],
   "credit": "toldot_tannaim"
  }
 },
 "era": {
  "value": "amoraim",
  "src": [
   "editorial"
  ]
 },
 "fields": {
  "name": {
   "value": "רבא בר משרשיא",
   "src": [
    "toldot_tannaim"
   ]
  },
  "known_as": [],
  "honorific": null,
  "generation": null,
  "region": [],
  "born": {
   "hebrew": null,
   "gregorian": null,
   "place": null
  },
  "died": {
   "hebrew": null,
   "gregorian": null,
   "place": null
  },
  "buried": null,
  "roles": [],
  "teachers": [],
  "students": [],
  "family": [],
  "works": [],
  "mentioned_in": {
   "value": "נזיר מ:",
   "src": [
    "toldot_tannaim"
   ]
  },
  "summary": {
   "value": "אמורא הנזכר בתלמוד במסכת נזיר כשהוא מקשה. לדעת בעל התולדות קושייתו לא הייתה על רבא אלא על רב אשי, שכן נראה ש'לרבא' שבגמרא הוא ראשי תיבות של 'לרב אשי', ובזה מתורצת קושיית בעל סדר הדורות.",
   "src": [
    "toldot_tannaim"
   ]
  },
  "remember": null
 },
 "review": {
  "status": "draft",
  "flags": [
   "התקופה (אמוראים) הוסקה מכך שהוא מקשה בגמרא, ולפי התולדות לרב אשי; התולדות אינו אומר 'אמורא' במפורש.",
   "פירוש 'לרבא' כראשי תיבות 'לרב אשי' הוא בלשון 'ונראה' בתולדות."
  ],
  "written": "2026-10-06"
 }
}
