{
 "id": "Q935621",
 "sources": {
  "wikipedia": {
   "title": "יצחק אבוהב דה-פונסיקה",
   "url": "https://he.wikipedia.org/wiki/%D7%99%D7%A6%D7%97%D7%A7_%D7%90%D7%91%D7%95%D7%94%D7%91_%D7%93%D7%94-%D7%A4%D7%95%D7%A0%D7%A1%D7%99%D7%A7%D7%94",
   "revid": 43188346,
   "retrieved": "2026-10-04",
   "raw": "data/raw/wikipedia/Q935621.wikitext",
   "credit": "wikipedia"
  },
  "wikidata": {
   "id": "Q935621",
   "url": "https://www.wikidata.org/wiki/Q935621",
   "retrieved": "2026-10-04",
   "raw": "data/raw/wikidata/Q935621.json",
   "credit": "wikidata"
  }
 },
 "era": {
  "value": "acharonim",
  "src": [
   "editorial"
  ]
 },
 "fields": {
  "name": {
   "value": "רבי יצחק אבוהב דה-פונסיקה",
   "src": [
    "wikipedia"
   ]
  },
  "known_as": [],
  "honorific": {
   "value": "זצ\"ל",
   "src": [
    "editorial"
   ]
  },
  "generation": null,
  "region": [
   {
    "value": "הולנד",
    "src": [
     "wikipedia"
    ]
   },
   {
    "value": "ברזיל",
    "src": [
     "wikipedia"
    ]
   }
  ],
  "born": {
   "hebrew": {
    "value": "י\"ג בשבט שס\"ה",
    "src": [
     "wikipedia"
    ]
   },
   "gregorian": {
    "value": "1605",
    "src": [
     "wikipedia",
     "wikidata"
    ]
   },
   "place": {
    "value": "קשטרו דיירה שבפורטוגל",
    "src": [
     "wikipedia"
    ],
    "alt": [
     {
      "value": "אמסטרדם",
      "src": [
       "wikidata"
      ]
     }
    ]
   }
  },
  "died": {
   "hebrew": {
    "value": "כ\"ז באדר ב' תנ\"ג",
    "src": [
     "wikipedia"
    ]
   },
   "gregorian": {
    "value": "1693",
    "src": [
     "wikidata"
    ]
   },
   "place": {
    "value": "אמסטרדם",
    "src": [
     "wikidata"
    ]
   }
  },
  "buried": null,
  "roles": [
   {
    "value": "חכם קהילת בית ישראל באמסטרדם",
    "src": [
     "wikipedia"
    ]
   },
   {
    "value": "רב העיר רסיפה בברזיל",
    "src": [
     "wikipedia"
    ]
   },
   {
    "value": "חכם קהילת אמסטרדם וראש ישיבת עץ חיים",
    "src": [
     "wikipedia"
    ]
   }
  ],
  "teachers": [
   {
    "value": "רבי יצחק עוזיאל",
    "src": [
     "wikipedia"
    ],
    "ref": "Q1673452"
   }
  ],
  "students": [],
  "family": [],
  "works": [
   {
    "value": {
     "title": "בית אלהים ושער השמים",
     "description": "תרגום לעברית של ספרי הקבלה של רבי אברהם כהן דה-הירירה"
    },
    "src": [
     "wikipedia"
    ]
   },
   {
    "value": {
     "title": "הגהות על משנה תורה",
     "description": "הגהות על דברי הרמב\"ם ומפרשיו, נדפסו בדפוס אמסטרדם"
    },
    "src": [
     "wikipedia"
    ]
   }
  ],
  "mentioned_in": null,
  "summary": {
   "value": "רב, דרשן ומקובל באמסטרדם, והרב הראשון בעולם החדש. נולד למשפחת אנוסים בפורטוגל, וברח בילדותו עם אמו להולנד. בגיל עשרים ואחת נתמנה לחכם קהילה באמסטרדם, ואחר כך כיהן כרבה של רסיפה שבברזיל. משחזר לאמסטרדם עמד בראש קהילתה וישיבת עץ חיים כארבעים שנה, ותרגם ספרי קבלה לעברית. יצא בגלוי נגד תנועת השבתאות.",
   "src": [
    "wikipedia"
   ]
  },
  "remember": null
 },
 "review": {
  "status": "draft",
  "flags": [
   "התקופה (אחרונים) נקבעה לפי הבקשה; המקורות אינם אומרים זאת במפורש.",
   "מקום הלידה: במאמר קשטרו דיירה שבפורטוגל, בוויקינתונים אמסטרדם; נבחר נוסח המאמר.",
   "שנת הפטירה הלועזית ומקום הפטירה מוויקינתונים בלבד. בוויקינתונים גם שנת לידה חלופית 1606.",
   "הושמטו מחלוקת עם רבי שאול מורטירה וחרם בית הדין שהיה חבר בו."
  ],
  "written": "2026-10-05"
 }
}
