{
 "id": "Q374146",
 "sources": {
  "wikipedia": {
   "title": "רבי יוסי בן קיסמא",
   "url": "https://he.wikipedia.org/wiki/%D7%A8%D7%91%D7%99_%D7%99%D7%95%D7%A1%D7%99_%D7%91%D7%9F_%D7%A7%D7%99%D7%A1%D7%9E%D7%90",
   "revid": 42150188,
   "retrieved": "2026-10-04",
   "raw": "data/raw/wikipedia/Q374146.wikitext",
   "credit": "wikipedia"
  },
  "wikidata": {
   "id": "Q374146",
   "url": "https://www.wikidata.org/wiki/Q374146",
   "retrieved": "2026-10-04",
   "raw": "data/raw/wikidata/Q374146.json",
   "credit": "wikidata"
  }
 },
 "era": {
  "value": "tannaim",
  "src": [
   "wikipedia",
   "wikidata"
  ]
 },
 "fields": {
  "name": {
   "value": "רבי יוסי בן קיסמא",
   "src": [
    "wikipedia",
    "wikidata"
   ]
  },
  "known_as": [],
  "honorific": null,
  "generation": {
   "value": "תנא בדור השלישי",
   "src": [
    "wikipedia"
   ]
  },
  "region": [
   {
    "value": "ארץ ישראל",
    "src": [
     "wikidata"
    ]
   }
  ],
  "born": {
   "hebrew": null,
   "gregorian": null,
   "place": null
  },
  "died": {
   "hebrew": null,
   "gregorian": null,
   "place": null
  },
  "buried": {
   "value": "הר מירון",
   "src": [
    "wikipedia"
   ]
  },
  "roles": [],
  "teachers": [],
  "students": [],
  "family": [],
  "works": [],
  "mentioned_in": {
   "value": "מוזכר במשנה ובגמרא",
   "src": [
    "wikipedia"
   ]
  },
  "summary": {
   "value": "תנא בדור השלישי בארץ ישראל. בימי גזירות המלכות נשא ונתן עם רבי חנינא בן תרדיון בענין לימוד התורה ברבים. לפני פטירתו ציוה את תלמידיו לקברו בעומק האדמה. כששאלוהו תלמידיו אימתי בן דוד בא, השיב שהשער ייפול וייבנה וייפול, ולא יספיקו לבנותו עד שיבוא בן דוד.",
   "src": [
    "wikipedia"
   ]
  },
  "remember": {
   "value": "אמר לאדם שהציע לו הון רב לדור במקומו: אם אתה נותן לי כל כסף וזהב שבעולם, איני דר אלא במקום תורה.",
   "src": [
    "wikipedia"
   ]
  }
 },
 "review": {
  "status": "draft",
  "flags": [
   "מקום הקבורה: המאמר מביא כמה מקורות שקברו בהר מירון, אך יש מחלוקת על זיהוי הציון המדויק."
  ],
  "written": "2026-10-05"
 }
}
