{
 "id": "Q3018222",
 "sources": {
  "wikipedia": {
   "title": "דוד כטורזה",
   "url": "https://he.wikipedia.org/wiki/%D7%93%D7%95%D7%93_%D7%9B%D7%98%D7%95%D7%A8%D7%96%D7%94",
   "revid": 43675188,
   "retrieved": "2026-10-04",
   "raw": "data/raw/wikipedia/Q3018222.wikitext",
   "credit": "wikipedia"
  },
  "wikidata": {
   "id": "Q3018222",
   "url": "https://www.wikidata.org/wiki/Q3018222",
   "retrieved": "2026-10-04",
   "raw": "data/raw/wikidata/Q3018222.json",
   "credit": "wikidata"
  }
 },
 "era": {
  "value": "acharonei_zmanenu",
  "src": [
   "editorial"
  ]
 },
 "fields": {
  "name": {
   "value": "רבי דוד כטורזה",
   "src": [
    "wikipedia"
   ]
  },
  "known_as": [],
  "honorific": {
   "value": "זצ\"ל",
   "src": [
    "editorial"
   ]
  },
  "generation": null,
  "region": [
   {
    "value": "תוניסיה",
    "src": [
     "wikipedia",
     "wikidata"
    ]
   }
  ],
  "born": {
   "hebrew": {
    "value": "ה'תרל\"ז",
    "src": [
     "wikipedia"
    ]
   },
   "gregorian": {
    "value": "1876",
    "src": [
     "wikipedia",
     "wikidata"
    ]
   },
   "place": {
    "value": "תוניס",
    "src": [
     "wikipedia",
     "wikidata"
    ]
   }
  },
  "died": {
   "hebrew": {
    "value": "י\"ט בכסלו ה'ת\"ש",
    "src": [
     "wikipedia"
    ]
   },
   "gregorian": {
    "value": "1939",
    "src": [
     "wikipedia",
     "wikidata"
    ]
   },
   "place": {
    "value": "תוניס",
    "src": [
     "wikipedia",
     "wikidata"
    ]
   }
  },
  "buried": {
   "value": "תוניס",
   "src": [
    "wikipedia",
    "wikidata"
   ]
  },
  "roles": [
   {
    "value": "הרב הראשי של יהדות תוניסיה",
    "src": [
     "wikipedia",
     "wikidata"
    ]
   },
   {
    "value": "ראש ישיבת \"חברת התלמוד\" בתוניס",
    "src": [
     "wikipedia"
    ]
   }
  ],
  "teachers": [
   {
    "value": "רבי שלמה דאנה, בעל \"שלמי תודה\"",
    "src": [
     "wikipedia"
    ],
    "ref": "Q55186731"
   }
  ],
  "students": [],
  "family": [
   {
    "value": {
     "relation": "אביו",
     "name": "ר' סעדאני כטורזא"
    },
    "src": [
     "wikipedia"
    ]
   }
  ],
  "works": [
   {
    "value": {
     "title": "תנובות שדי",
     "description": "על הלכות שחיטה וטריפות, יחד עם חברו הרב ישועה אלמליח"
    },
    "src": [
     "wikipedia"
    ]
   },
   {
    "value": {
     "title": "עיני דוד",
     "description": "על שולחן ערוך אבן העזר"
    },
    "src": [
     "wikipedia"
    ]
   },
   {
    "value": {
     "title": "וידבר דוד",
     "description": "חידושים על סדר הש\"ס, שנדפסו מכתב ידו"
    },
    "src": [
     "wikipedia"
    ]
   }
  ],
  "mentioned_in": null,
  "summary": {
   "value": "מרבני תוניס, יוצא הקהילה הליבורנית שבה, שלמד בישיבת \"חברת התלמוד\" מפי רבי שלמה דאנה ומילא את מקומו בראשות הישיבה לאחר פטירתו. בשנת ה'תרצ\"ד נתמנה לרב הראשי של יהודי תוניסיה, ושימש בתפקיד זה עד יום פטירתו. חיבר ספרים בהלכה ובחידושי ש\"ס, ותשובותיו מובאות בספרי חכמי תוניס וג'רבה.",
   "src": [
    "wikipedia"
   ]
  },
  "remember": {
   "value": "כשבאו השלטונות להרוס מבנים ברובע היהודי, פנה אליהם והצליח להציל מהריסה את בית הכנסת העתיק \"צלאת פריחא\".",
   "src": [
    "wikipedia"
   ]
  }
 },
 "review": {
  "status": "draft",
  "flags": [],
  "written": "2026-10-05"
 }
}
