{
 "id": "Q113355475",
 "sources": {
  "wikipedia": {
   "title": "בוגיד חנינא סעדון",
   "url": "https://he.wikipedia.org/wiki/%D7%91%D7%95%D7%92%D7%99%D7%93_%D7%97%D7%A0%D7%99%D7%A0%D7%90_%D7%A1%D7%A2%D7%93%D7%95%D7%9F",
   "revid": 42985872,
   "retrieved": "2026-10-04",
   "raw": "data/raw/wikipedia/Q113355475.wikitext",
   "credit": "wikipedia"
  },
  "wikidata": {
   "id": "Q113355475",
   "url": "https://www.wikidata.org/wiki/Q113355475",
   "retrieved": "2026-10-04",
   "raw": "data/raw/wikidata/Q113355475.json",
   "credit": "wikidata"
  },
  "seder_hadorot_segron": {
   "rows": [
    738
   ],
   "url": "http://www.toratemetfreeware.com/online/f_01825.html",
   "raw": "data/raw/seder_hadorot_segron/f_01825.html",
   "credit": "seder_hadorot_segron"
  }
 },
 "era": {
  "value": "acharonei_zmanenu",
  "src": [
   "editorial"
  ]
 },
 "fields": {
  "name": {
   "value": "רבי בוגיד חנינא סעדון",
   "src": [
    "wikipedia",
    "seder_hadorot_segron"
   ]
  },
  "known_as": [
   {
    "value": "בעל \"מגיד תשובה\"",
    "src": [
     "wikipedia",
     "seder_hadorot_segron"
    ]
   }
  ],
  "honorific": {
   "value": "זצ\"ל",
   "src": [
    "editorial"
   ]
  },
  "generation": null,
  "region": [
   {
    "value": "תוניסיה",
    "src": [
     "wikipedia"
    ]
   },
   {
    "value": "צרפת",
    "src": [
     "wikipedia",
     "wikidata"
    ]
   }
  ],
  "born": {
   "hebrew": {
    "value": "י\"ג באב ה'תרע\"ו",
    "src": [
     "wikipedia"
    ]
   },
   "gregorian": {
    "value": "1916",
    "src": [
     "wikipedia",
     "wikidata"
    ]
   },
   "place": {
    "value": "ג'רבה",
    "src": [
     "wikipedia",
     "wikidata"
    ]
   }
  },
  "died": {
   "hebrew": {
    "value": "כ' בניסן ה'תשס\"ו",
    "src": [
     "wikipedia"
    ]
   },
   "gregorian": {
    "value": "2006",
    "src": [
     "wikipedia",
     "wikidata"
    ]
   },
   "place": {
    "value": "פריז",
    "src": [
     "wikidata"
    ]
   }
  },
  "buried": {
   "value": "הר המנוחות בירושלים",
   "src": [
    "wikipedia",
    "wikidata"
   ]
  },
  "roles": [
   {
    "value": "הרב הראשי ואב בית הדין של ג'רבה",
    "src": [
     "wikipedia"
    ]
   },
   {
    "value": "רב עדת יוצאי תוניסיה בפריז",
    "src": [
     "wikipedia"
    ]
   },
   {
    "value": "ראש ישיבת \"תורה ורחמים\" בפריז",
    "src": [
     "wikipedia"
    ]
   }
  ],
  "teachers": [
   {
    "value": "רבי רחמים חי חויתה הכהן",
    "src": [
     "wikipedia",
     "wikidata"
    ],
    "ref": "Q6763013"
   },
   {
    "value": "רבי שאול מקיקץ שלי",
    "src": [
     "wikipedia",
     "wikidata"
    ],
    "ref": "Q20502910"
   },
   {
    "value": "רבי רפאל כדיר צבאן",
    "src": [
     "wikipedia",
     "wikidata"
    ],
    "ref": "Q18510951"
   },
   {
    "value": "רבי דוד דידו הכהן",
    "src": [
     "wikipedia"
    ]
   }
  ],
  "students": [
   {
    "value": "הרב חיים ביתאן, רבה הראשי של תוניסיה",
    "src": [
     "wikipedia"
    ]
   },
   {
    "value": "הרב ישראל כהן, בעל \"בך יברך\"",
    "src": [
     "wikipedia"
    ]
   }
  ],
  "family": [
   {
    "value": {
     "relation": "אביו",
     "name": "רבי מרדכי (מכני) סעדון"
    },
    "src": [
     "wikipedia"
    ]
   },
   {
    "value": {
     "relation": "חותנו",
     "name": "רבי מעתוק מאזוז, בעל \"מתוק מדבש\""
    },
    "src": [
     "wikipedia"
    ]
   },
   {
    "value": {
     "relation": "אחיו",
     "name": "רבי מקיקץ-דוד סעדון, בעל \"חגי דוד\""
    },
    "src": [
     "wikipedia"
    ]
   },
   {
    "value": {
     "relation": "בן אחותו",
     "name": "הרב מצליח מאזוז"
    },
    "src": [
     "wikipedia"
    ],
    "ref": "Q6777300"
   }
  ],
  "works": [
   {
    "value": {
     "title": "מגיד תשובה",
     "description": "שאלות ותשובות, בשמונה כרכים"
    },
    "src": [
     "wikipedia"
    ]
   },
   {
    "value": {
     "title": "מגיד חדשות",
     "description": "חידושים על הש\"ס, באחד עשר כרכים"
    },
    "src": [
     "wikipedia"
    ]
   },
   {
    "value": {
     "title": "הגיד לעמו",
     "description": "הגדה של פסח עם תרגום לערבית ופירושים"
    },
    "src": [
     "wikipedia"
    ]
   },
   {
    "value": {
     "title": "מדות הרחמים",
     "description": "תולדות רבו רבי רחמים חי חויתה הכהן"
    },
    "src": [
     "wikipedia"
    ]
   },
   {
    "value": {
     "title": "דרישת הרחמים",
     "description": "דרשות ביום הזיכרון של רבו"
    },
    "src": [
     "wikipedia"
    ]
   }
  ],
  "mentioned_in": null,
  "summary": {
   "value": "מגדולי חכמי ג'רבה. למד בישיבת רבי רחמים חי חויתה הכהן, ובשנת 1965 נבחר לרבה הראשי של ג'רבה ולאב בית הדין, ואיחד את הישיבות הקטנות שבאי למקום אחד. בשנת 1991 עבר לפריז, כיהן כרב יוצאי תוניסיה שם וייסד את ישיבת \"תורה ורחמים\" על שם רבו. חיבר שו\"ת \"מגיד תשובה\" וחידושי \"מגיד חדשות\" על הש\"ס.",
   "src": [
    "wikipedia"
   ]
  },
  "remember": {
   "value": "כל ימיו סירב ליטול שכר על רבנותו ועל דיינותו, והתפרנס מחנות מכולת קטנה ומממכר תשמישי קדושה.",
   "src": [
    "wikipedia"
   ]
  }
 },
 "review": {
  "status": "draft",
  "flags": [
   "מקום הפטירה (פריז) מופיע רק בוויקינתונים.",
   "שורת סדר הדורות 738 מאשרת את שנות הלידה והפטירה (ה'תרע\"ו-ה'תשס\"ו).",
   "התקופה (אחרוני זמננו) נקבעה לפי השנים; המקורות אינם אומרים זאת במפורש."
  ],
  "written": "2026-10-05"
 }
}
