{
 "id": "Q6908703",
 "sources": {
  "wikipedia": {
   "title": "ברוך מנדלבוים",
   "url": "https://he.wikipedia.org/wiki/%D7%91%D7%A8%D7%95%D7%9A_%D7%9E%D7%A0%D7%93%D7%9C%D7%91%D7%95%D7%99%D7%9D",
   "revid": 40411003,
   "retrieved": "2026-10-04",
   "raw": "data/raw/wikipedia/Q6908703.wikitext",
   "credit": "wikipedia"
  },
  "wikidata": {
   "id": "Q6908703",
   "url": "https://www.wikidata.org/wiki/Q6908703",
   "retrieved": "2026-10-04",
   "raw": "data/raw/wikidata/Q6908703.json",
   "credit": "wikidata"
  }
 },
 "era": {
  "value": "acharonei_zmanenu",
  "src": [
   "editorial"
  ]
 },
 "fields": {
  "name": {
   "value": "רבי ברוך מנדלבוים",
   "src": [
    "wikipedia"
   ]
  },
  "known_as": [
   {
    "value": "הרב מטורוב",
    "src": [
     "wikipedia"
    ]
   }
  ],
  "honorific": {
   "value": "זצ\"ל",
   "src": [
    "editorial"
   ]
  },
  "generation": null,
  "region": [
   {
    "value": "רוסיה הלבנה",
    "src": [
     "wikipedia",
     "wikidata"
    ]
   },
   {
    "value": "ארץ ישראל",
    "src": [
     "wikipedia"
    ]
   }
  ],
  "born": {
   "hebrew": {
    "value": "כ\"ב בטבת תקצ\"ד",
    "src": [
     "wikipedia"
    ]
   },
   "gregorian": {
    "value": "1834",
    "src": [
     "wikipedia",
     "wikidata"
    ]
   },
   "place": {
    "value": "רוסיה הלבנה",
    "src": [
     "wikipedia",
     "wikidata"
    ]
   }
  },
  "died": {
   "hebrew": {
    "value": "י\"ז באייר תרס\"ה",
    "src": [
     "wikipedia"
    ]
   },
   "gregorian": {
    "value": "1905",
    "src": [
     "wikipedia",
     "wikidata"
    ]
   },
   "place": null
  },
  "buried": {
   "value": "הר הזיתים",
   "src": [
    "wikipedia",
    "wikidata"
   ]
  },
  "roles": [
   {
    "value": "רבן של מציוב, סטולין וטורוב",
    "src": [
     "wikipedia"
    ]
   },
   {
    "value": "מייסד ישיבת \"אור חדש\" בירושלים",
    "src": [
     "wikipedia"
    ]
   },
   {
    "value": "שד\"ר בשליחות הכוללים בירושלים",
    "src": [
     "wikipedia"
    ]
   }
  ],
  "teachers": [
   {
    "value": "אביו רבי מרדכי יהודה לייב מנדלבוים",
    "src": [
     "wikipedia"
    ]
   }
  ],
  "students": [],
  "family": [
   {
    "value": {
     "relation": "אביו",
     "name": "רבי מרדכי יהודה לייב מנדלבוים, רבה של וולדובקה"
    },
    "src": [
     "wikipedia"
    ]
   },
   {
    "value": {
     "relation": "חותנו",
     "name": "רבי יעקב טייטלבוים מירושלים"
    },
    "src": [
     "wikipedia"
    ]
   },
   {
    "value": {
     "relation": "בנו",
     "name": "רבי בצלאל מנדלבוים, רבה של מלבורן"
    },
    "src": [
     "wikipedia"
    ]
   },
   {
    "value": {
     "relation": "בנו",
     "name": "רבי יעקב מנדלבוים, ראש השוחטים בירושלים"
    },
    "src": [
     "wikipedia"
    ]
   }
  ],
  "works": [
   {
    "value": {
     "title": "נודע בשערים",
     "description": "נדפס בחייו בירושלים, וחלק שני יצא מכתבי ידו"
    },
    "src": [
     "wikipedia"
    ]
   }
  ],
  "mentioned_in": null,
  "summary": {
   "value": "מחשובי חסידי קרלין, שהסתופף בצל רבי אהרן מקרלין ורבי אשר מסטולין. למד תורה אצל אביו, וכיהן כרב בערים מציוב, סטולין וטורוב, ועל שם האחרונה נודע. טיפח את רבי ישראל פרלוב, \"הינוקא מסטולין\", והכינו מילדותו להנהגת החסידות. בשנת תרל\"ד עלה לירושלים עם משפחתו, ייסד בה את ישיבת \"אור חדש\", ויצא לחוץ לארץ בשליחות הכוללים. ממנו יצאה משפחת מנדלבוים הענפה בירושלים.",
   "src": [
    "wikipedia"
   ]
  },
  "remember": {
   "value": "בין חבריו בימי נעוריו היה רבי צדוק הכהן מלובלין.",
   "src": [
    "wikipedia"
   ]
  }
 },
 "review": {
  "status": "draft",
  "flags": [
   "התקופה לפי כלל המרשם: נפטר בשנת 1905.",
   "מקום הלידה: המקורות אומרים רק 'בלארוס'."
  ],
  "written": "2026-10-05"
 }
}
