{
 "id": "Q4802688",
 "sources": {
  "wikipedia": {
   "title": "אריה לוין",
   "url": "https://he.wikipedia.org/wiki/%D7%90%D7%A8%D7%99%D7%94_%D7%9C%D7%95%D7%99%D7%9F",
   "revid": 43240766,
   "retrieved": "2026-10-04",
   "raw": "data/raw/wikipedia/Q4802688.wikitext",
   "credit": "wikipedia"
  },
  "wikidata": {
   "id": "Q4802688",
   "url": "https://www.wikidata.org/wiki/Q4802688",
   "retrieved": "2026-10-04",
   "raw": "data/raw/wikidata/Q4802688.json",
   "credit": "wikidata"
  },
  "seder_hadorot_segron": {
   "rows": [
    693
   ],
   "url": "http://www.toratemetfreeware.com/online/f_01825.html",
   "raw": "data/raw/seder_hadorot_segron/f_01825.html",
   "credit": "seder_hadorot_segron"
  }
 },
 "era": {
  "value": "acharonei_zmanenu",
  "src": [
   "editorial"
  ]
 },
 "fields": {
  "name": {
   "value": "רבי אריה לוין",
   "src": [
    "wikipedia",
    "seder_hadorot_segron"
   ]
  },
  "known_as": [
   {
    "value": "רב האסירים",
    "src": [
     "wikipedia",
     "wikidata",
     "seder_hadorot_segron"
    ]
   },
   {
    "value": "אבי האסירים",
    "src": [
     "wikipedia",
     "wikidata"
    ]
   },
   {
    "value": "ר' אריה",
    "src": [
     "wikipedia"
    ]
   }
  ],
  "honorific": {
   "value": "זצ\"ל",
   "src": [
    "editorial"
   ]
  },
  "generation": null,
  "region": [
   {
    "value": "ארץ ישראל",
    "src": [
     "wikipedia"
    ]
   }
  ],
  "born": {
   "hebrew": {
    "value": "ו' בניסן ה'תרמ\"ה",
    "src": [
     "wikipedia"
    ]
   },
   "gregorian": {
    "value": "1885",
    "src": [
     "wikipedia",
     "wikidata"
    ]
   },
   "place": {
    "value": "אורלא שליד ביאליסטוק",
    "src": [
     "wikipedia"
    ]
   }
  },
  "died": {
   "hebrew": {
    "value": "ט' בניסן ה'תשכ\"ט",
    "src": [
     "wikipedia"
    ]
   },
   "gregorian": {
    "value": "1969",
    "src": [
     "wikipedia",
     "wikidata"
    ]
   },
   "place": {
    "value": "ירושלים",
    "src": [
     "wikipedia",
     "wikidata"
    ]
   }
  },
  "buried": {
   "value": "בית הקברות סנהדריה בירושלים",
   "src": [
    "wikipedia",
    "wikidata"
   ]
  },
  "roles": [
   {
    "value": "משגיח בתלמוד תורה עץ חיים בירושלים",
    "src": [
     "wikipedia"
    ]
   },
   {
    "value": "מייסד ישיבת \"בית אריה\"",
    "src": [
     "wikipedia"
    ]
   }
  ],
  "teachers": [
   {
    "value": "רבי רפאל שפירא, ראש ישיבת וולוז'ין",
    "src": [
     "wikipedia"
    ]
   },
   {
    "value": "רבי שלמה אלישיב בעל ה\"לשם\"",
    "src": [
     "wikipedia"
    ],
    "ref": "Q2239932"
   },
   {
    "value": "הראי\"ה קוק",
    "src": [
     "wikipedia",
     "wikidata"
    ],
    "ref": "Q330110"
   }
  ],
  "students": [],
  "family": [
   {
    "value": {
     "relation": "חותנו",
     "name": "רבי דוד שפירא, רב בקובנה"
    },
    "src": [
     "wikipedia"
    ],
    "ref": "Q25496854"
   },
   {
    "value": {
     "relation": "חתנו",
     "name": "רבי יוסף שלום אלישיב"
    },
    "src": [
     "wikipedia"
    ],
    "ref": "Q983259"
   },
   {
    "value": {
     "relation": "בנו",
     "name": "רבי חיים יעקב לוין, רבה של פרדס חנה-כרכור"
    },
    "src": [
     "wikipedia"
    ],
    "ref": "Q7021235"
   }
  ],
  "works": [
   {
    "value": {
     "title": "משנת אריה",
     "description": "פירוש על המשנה"
    },
    "src": [
     "wikipedia"
    ]
   },
   {
    "value": {
     "title": "ר' אריה היה אומר",
     "description": "מסכת אבות בביאורו"
    },
    "src": [
     "wikipedia"
    ]
   }
  ],
  "mentioned_in": null,
  "summary": {
   "value": "צדיק ירושלמי שנודע כאיש חסד, משגיח בתלמוד תורה עץ חיים מתרע\"ז. נולד באורלא, למד בישיבת וולוז'ין אצל רבי רפאל שפירא, ובשנת תרס\"ה עלה לארץ ישראל ולמד בירושלים בישיבת תורת חיים. חי בצניעות וברח מן הכבוד, אסף לביתו ילדים עזובים וחולים, ובמשך כעשרים וחמש שנה הלך ברגל בכל שבת לבקר את האסירים בבתי הכלא ולחזק את רוחם, ועל כן כונה \"רב האסירים\".",
   "src": [
    "wikipedia"
   ]
  },
  "remember": {
   "value": "ידועים דבריו לרופא ד\"ר נחום קוק: \"רגלה של אשתי כואבת לי\".",
   "src": [
    "wikipedia"
   ]
  }
 },
 "review": {
  "status": "draft",
  "flags": [
   "מקום הלידה: במאמר אורלא שליד ביאליסטוק, בוויקינתונים ביאליסטוק; נבחר נוסח המאמר.",
   "פעילותו הציבורית בענייני המחתרות והמדינה הושמטה במכוון."
  ],
  "written": "2026-10-05"
 }
}
