{
 "id": "Q2896679",
 "sources": {
  "wikipedia": {
   "title": "יעקב מאורליינש",
   "url": "https://he.wikipedia.org/wiki/%D7%99%D7%A2%D7%A7%D7%91_%D7%9E%D7%90%D7%95%D7%A8%D7%9C%D7%99%D7%99%D7%A0%D7%A9",
   "revid": 43364676,
   "retrieved": "2026-10-04",
   "raw": "data/raw/wikipedia/Q2896679.wikitext",
   "credit": "wikipedia"
  },
  "wikidata": {
   "id": "Q2896679",
   "url": "https://www.wikidata.org/wiki/Q2896679",
   "retrieved": "2026-10-04",
   "raw": "data/raw/wikidata/Q2896679.json",
   "credit": "wikidata"
  }
 },
 "era": {
  "value": "rishonim",
  "src": [
   "editorial"
  ]
 },
 "fields": {
  "name": {
   "value": "רבי יעקב מאורליינש",
   "src": [
    "wikipedia",
    "wikidata"
   ]
  },
  "known_as": [
   {
    "value": "רבנו תם מאורליינש",
    "src": [
     "wikipedia",
     "wikidata"
    ]
   },
   {
    "value": "רבנו יעקב הקדוש",
    "src": [
     "wikipedia",
     "wikidata"
    ]
   }
  ],
  "honorific": {
   "value": "הי\"ד",
   "src": [
    "editorial"
   ]
  },
  "generation": null,
  "region": [
   {
    "value": "צרפת",
    "src": [
     "wikipedia"
    ]
   },
   {
    "value": "אנגליה",
    "src": [
     "wikipedia"
    ]
   }
  ],
  "born": {
   "hebrew": null,
   "gregorian": null,
   "place": null
  },
  "died": {
   "hebrew": {
    "value": "י\"ט באלול ד'תתקמ\"ט",
    "src": [
     "wikipedia"
    ]
   },
   "gregorian": {
    "value": "1189",
    "src": [
     "wikipedia",
     "wikidata"
    ]
   },
   "place": {
    "value": "לונדון",
    "src": [
     "wikipedia"
    ]
   }
  },
  "buried": null,
  "roles": [],
  "teachers": [
   {
    "value": "רבנו תם",
    "src": [
     "wikipedia"
    ],
    "ref": "Q944289"
   }
  ],
  "students": [],
  "family": [],
  "works": [
   {
    "value": {
     "title": "תוספות",
     "description": "חידושיו מובאים רבות בתוספות הנדפסות ובספרי הראשונים"
    },
    "src": [
     "wikipedia"
    ]
   }
  ],
  "mentioned_in": null,
  "summary": {
   "value": "מבעלי התוספות ומתלמידי רבנו תם. ישב באורליאן שבצרפת ואחר כך עבר ללונדון, כנראה כדי להורות בה. עשרות מחידושיו מובאים בתוספות הנדפסות על הש\"ס ובספרי ההלכה של הראשונים. נהרג על קידוש השם בפרעות שנעשו ביהודי לונדון בשנת ד'תתקמ\"ט (1189).",
   "src": [
    "wikipedia"
   ]
  },
  "remember": {
   "value": "מחידושיו שנתקבלו בפוסקים: בשעת קור גדול מותר לומר לגוי בשבת להסיק את התנור, שאפילו בריא עלול לחלות מן הקור.",
   "src": [
    "wikipedia"
   ]
  }
 },
 "review": {
  "status": "draft",
  "flags": [
   "התואר הי\"ד נבחר משום שנהרג על קידוש השם; לשקול אם להשתמש בזצ\"ל כמקובל לראשונים.",
   "התקופה (ראשונים) לא נאמרה במפורש; נקבעה לפי היותו מבעלי התוספות.",
   "ייחוס ספר הישר לו, והשערה שחיבר תוספות על פירוש רש\"י לתורה, לא הובאו."
  ],
  "written": "2026-10-05"
 }
}
