{
 "id": "Q12254977",
 "sources": {
  "wikipedia": {
   "title": "יעקב יצחק ניימן",
   "url": "https://he.wikipedia.org/wiki/%D7%99%D7%A2%D7%A7%D7%91_%D7%99%D7%A6%D7%97%D7%A7_%D7%A0%D7%99%D7%99%D7%9E%D7%9F",
   "revid": 41197271,
   "retrieved": "2026-10-04",
   "raw": "data/raw/wikipedia/Q12254977.wikitext",
   "credit": "wikipedia"
  },
  "wikidata": {
   "id": "Q12254977",
   "url": "https://www.wikidata.org/wiki/Q12254977",
   "retrieved": "2026-10-04",
   "raw": "data/raw/wikidata/Q12254977.json",
   "credit": "wikidata"
  }
 },
 "era": {
  "value": "acharonei_zmanenu",
  "src": [
   "editorial"
  ]
 },
 "fields": {
  "name": {
   "value": "רבי יעקב יצחק ניימן",
   "src": [
    "wikipedia"
   ]
  },
  "known_as": [],
  "honorific": {
   "value": "זצ\"ל",
   "src": [
    "editorial"
   ]
  },
  "generation": null,
  "region": [
   {
    "value": "הונגריה",
    "src": [
     "wikipedia"
    ]
   },
   {
    "value": "אוסטרליה",
    "src": [
     "wikipedia"
    ]
   },
   {
    "value": "מונטריאול",
    "src": [
     "wikipedia"
    ]
   }
  ],
  "born": {
   "hebrew": {
    "value": "ה'תר\"פ",
    "src": [
     "wikipedia"
    ]
   },
   "gregorian": {
    "value": "1920",
    "src": [
     "wikipedia",
     "wikidata"
    ]
   },
   "place": {
    "value": "הונגריה",
    "src": [
     "wikipedia"
    ]
   }
  },
  "died": {
   "hebrew": {
    "value": "ז' בשבט ה'תשס\"ז",
    "src": [
     "wikipedia"
    ]
   },
   "gregorian": {
    "value": "2007",
    "src": [
     "wikipedia",
     "wikidata"
    ]
   },
   "place": null
  },
  "buried": {
   "value": "חלקת קהילת פאפה בקרית פאפה בניו יורק",
   "src": [
    "wikipedia"
   ]
  },
  "roles": [
   {
    "value": "רבה ואב\"ד של הקהילה החרדית במלבורן",
    "src": [
     "wikipedia"
    ]
   },
   {
    "value": "רב קהילת חסידי בעלזא 'קהל מחזיקי הדת' במונטריאול",
    "src": [
     "wikipedia"
    ]
   }
  ],
  "teachers": [
   {
    "value": "רבי יעקב יחזקיה גרינוולד בעל \"ויגד יעקב\", רבה של פאפה",
    "src": [
     "wikipedia"
    ],
    "ref": "Q12408179"
   },
   {
    "value": "רבי יוסף גרינוולד",
    "src": [
     "wikipedia"
    ],
    "ref": "Q7212938"
   }
  ],
  "students": [],
  "family": [
   {
    "value": {
     "relation": "אביו",
     "name": "רבי יוסף ניימן, רב באובודה"
    },
    "src": [
     "wikipedia"
    ]
   },
   {
    "value": {
     "relation": "חותנו",
     "name": "רבי יעקב יחזקיהו גרינוולד"
    },
    "src": [
     "wikipedia"
    ],
    "ref": "Q12408179"
   }
  ],
  "works": [],
  "mentioned_in": null,
  "summary": {
   "value": "מרבני חסידות בעלזא. בבחרותו למד אצל רבי יעקב יחזקיה גרינוולד, רבה של פאפה. לאחר השואה, שבה נספו אשתו ובנו, היגר לאוסטרליה וייסד את הקהילה החרדית במלבורן ועמד בראשה, ולאחר מכן עבר למונטריאול ושימש שם רב קהילת חסידי בעלזא 'קהל מחזיקי הדת'.",
   "src": [
    "wikipedia"
   ]
  },
  "remember": null
 },
 "review": {
  "status": "draft",
  "flags": [
   "התקופה נקבעה לפי הרשימה המבוקשת; המקורות אינם אומרים זאת במפורש.",
   "רבי יוסף גרינוולד כרבו מופיע רק בתבנית המידע, לא בגוף המאמר."
  ],
  "written": "2026-10-05"
 }
}
