{
 "id": "tta-333357",
 "sources": {
  "toldot_tannaim": {
   "pages": [
    {
     "title": "תולדות תנאים ואמוראים/א/רב אדא בר אבימי",
     "url": "https://he.wikisource.org/wiki/%D7%AA%D7%95%D7%9C%D7%93%D7%95%D7%AA_%D7%AA%D7%A0%D7%90%D7%99%D7%9D_%D7%95%D7%90%D7%9E%D7%95%D7%A8%D7%90%D7%99%D7%9D%2F%D7%90%2F%D7%A8%D7%91_%D7%90%D7%93%D7%90_%D7%91%D7%A8_%D7%90%D7%91%D7%99%D7%9E%D7%99",
     "revid": 764612,
     "raw": "data/raw/toldot_tannaim/scans.json"
    }
   ],
   "credit": "toldot_tannaim"
  }
 },
 "era": {
  "value": "amoraim",
  "src": [
   "toldot_tannaim"
  ]
 },
 "fields": {
  "name": {
   "value": "רב אדא בר אבימי",
   "src": [
    "toldot_tannaim"
   ]
  },
  "known_as": [],
  "honorific": null,
  "generation": {
   "value": "אמורא ארץ ישראל בדור הרביעי",
   "src": [
    "toldot_tannaim"
   ]
  },
  "region": [
   {
    "value": "ארץ ישראל",
    "src": [
     "toldot_tannaim"
    ]
   }
  ],
  "born": {
   "hebrew": null,
   "gregorian": null,
   "place": null
  },
  "died": {
   "hebrew": null,
   "gregorian": null,
   "place": null
  },
  "buried": null,
  "roles": [],
  "teachers": [
   {
    "value": "רבי חנינא",
    "src": [
     "toldot_tannaim"
    ]
   },
   {
    "value": "רבי זעירא",
    "src": [
     "toldot_tannaim"
    ]
   }
  ],
  "students": [],
  "family": [],
  "works": [],
  "mentioned_in": {
   "value": "מסכת עירובין, ובתלמוד ירושלמי במסכתות ברכות ותענית",
   "src": [
    "toldot_tannaim"
   ]
  },
  "summary": {
   "value": "אמורא בארץ ישראל בדור הרביעי. למד לפני רבי חנינא ושנה לפניו ברייתות, והיה גם מתלמידיו של רבי זעירא. בירושלמי נזכר יחד עם חבריו רבי חזקיה ורבי נחום.",
   "src": [
    "toldot_tannaim"
   ]
  },
  "remember": null
 },
 "review": {
  "status": "draft",
  "flags": [
   "בעירובין יב. יש גורסים שהיה שונה לפני רבי חנינא בר פפי; ביוחסין נגרס שמו אבא בר אבימי, וברש\"י (עירובין יד:) אדא בר מניומי, שיש לו מזהה נפרד במאגר."
  ],
  "written": "2026-10-22"
 }
}
