{
 "id": "Q56421715",
 "sources": {
  "wikipedia": {
   "title": "חיים יהושע אלעזר הכהן חמצי",
   "url": "https://he.wikipedia.org/wiki/%D7%97%D7%99%D7%99%D7%9D_%D7%99%D7%94%D7%95%D7%A9%D7%A2_%D7%90%D7%9C%D7%A2%D7%96%D7%A8_%D7%94%D7%9B%D7%94%D7%9F_%D7%97%D7%9E%D7%A6%D7%99",
   "revid": 40581215,
   "retrieved": "2026-10-04",
   "raw": "data/raw/wikipedia/Q56421715.wikitext",
   "credit": "wikipedia"
  },
  "wikidata": {
   "id": "Q56421715",
   "url": "https://www.wikidata.org/wiki/Q56421715",
   "retrieved": "2026-10-04",
   "raw": "data/raw/wikidata/Q56421715.json",
   "credit": "wikidata"
  }
 },
 "era": {
  "value": "acharonim",
  "src": [
   "editorial"
  ]
 },
 "fields": {
  "name": {
   "value": "רבי חיים יהושע אלעזר הכהן חמצי",
   "src": [
    "wikipedia"
   ]
  },
  "known_as": [],
  "honorific": {
   "value": "זצ\"ל",
   "src": [
    "editorial"
   ]
  },
  "generation": null,
  "region": [
   {
    "value": "טורקיה",
    "src": [
     "wikipedia"
    ]
   },
   {
    "value": "ארץ ישראל",
    "src": [
     "wikipedia"
    ]
   }
  ],
  "born": {
   "hebrew": {
    "value": "ה'תקנ\"ה",
    "src": [
     "wikipedia"
    ],
    "alt": [
     {
      "value": "ה'תקס\"ו",
      "src": [
       "wikipedia"
      ]
     }
    ]
   },
   "gregorian": {
    "value": "1795",
    "src": [
     "wikipedia",
     "wikidata"
    ],
    "alt": [
     {
      "value": "1806",
      "src": [
       "wikipedia"
      ]
     }
    ]
   },
   "place": {
    "value": "איזמיר",
    "src": [
     "wikipedia",
     "wikidata"
    ]
   }
  },
  "died": {
   "hebrew": {
    "value": "כ\"ו באדר ב' ה'תרמ\"א",
    "src": [
     "wikipedia"
    ]
   },
   "gregorian": {
    "value": "1881",
    "src": [
     "wikipedia",
     "wikidata"
    ]
   },
   "place": null
  },
  "buried": {
   "value": "חיפה",
   "src": [
    "wikipedia",
    "wikidata"
   ]
  },
  "roles": [
   {
    "value": "רב ואב בית הדין של חיפה",
    "src": [
     "wikipedia"
    ]
   }
  ],
  "teachers": [
   {
    "value": "רבי פנחס רפאל יהושע די שיגורה (רבו המובהק)",
    "src": [
     "wikipedia"
    ]
   },
   {
    "value": "רבי רפאל יצחק מאיו",
    "src": [
     "wikipedia",
     "wikidata"
    ],
    "ref": "Q30118800"
   },
   {
    "value": "רבי חיים פלאג'י",
    "src": [
     "wikipedia",
     "wikidata"
    ],
    "ref": "Q2903944"
   },
   {
    "value": "רבי שלמה חכים",
    "src": [
     "wikipedia"
    ]
   },
   {
    "value": "רבי דוד אמאדו",
    "src": [
     "wikipedia"
    ],
    "ref": "Q111465852"
   }
  ],
  "students": [],
  "family": [
   {
    "value": {
     "relation": "אביו",
     "name": "יוסף הכהן חמצי, גביר שהקים והחזיק שתי ישיבות באיזמיר"
    },
    "src": [
     "wikipedia"
    ]
   },
   {
    "value": {
     "relation": "סבו (אבי אמו)",
     "name": "רבי חיים יצחק אלגאזי"
    },
    "src": [
     "wikipedia"
    ]
   },
   {
    "value": {
     "relation": "בניו",
     "name": "משה ואליעזר הכהן חמצי, שמחידושיהם הובאו בספרי אביהם"
    },
    "src": [
     "wikipedia"
    ]
   }
  ],
  "works": [
   {
    "value": {
     "title": "כה תברכו",
     "description": "דיני נשיאת כפיים מסודרים על סדר א-ב"
    },
    "src": [
     "wikipedia"
    ]
   },
   {
    "value": {
     "title": "ולבש הכהן",
     "description": "דרושים וחידושים"
    },
    "src": [
     "wikipedia"
    ]
   },
   {
    "value": {
     "title": "מעשה אבות",
     "description": "פירוש על פרקי אבות, נדפס מכתב יד"
    },
    "src": [
     "wikipedia"
    ]
   },
   {
    "value": {
     "title": "מעשה חי\"א",
     "description": "פירוש להגדה של פסח, נדפס מכתב יד"
    },
    "src": [
     "wikipedia"
    ]
   }
  ],
  "mentioned_in": null,
  "summary": {
   "value": "מחכמי איזמיר שבטורקיה. גדל בבית המדרש \"בית יצחק\" שהקים אביו בביתו, ולמד לפני רבני העיר. בסביבות שנת ה'תר\"ך עלה לארץ ישראל והתיישב בחיפה, ושם כיהן כרב וכאב בית הדין עד יומו האחרון, בראשית ימי הקהילה היהודית בעיר. משם המשיך להשיב בדברי הלכה לרבני איזמיר ולקהילות נוספות.",
   "src": [
    "wikipedia"
   ]
  },
  "remember": {
   "value": "בלידתו נקרא שמו אלעזר, ורק לאחר מכן נוספו לו השמות חיים ויהושע.",
   "src": [
    "wikipedia"
   ]
  }
 },
 "review": {
  "status": "draft",
  "flags": [
   "שנת הלידה: בתיבת המידע ובוויקינתונים 1795 (ה'תקנ\"ה), ובגוף המאמר 1806 (ה'תקס\"ו) - נבחרה שנת תיבת המידע, והשנייה ב-alt.",
   "התקופה (אחרונים) נקבעה לפי הבקשה; המקורות אינם אומרים זאת במפורש."
  ],
  "written": "2026-10-05"
 }
}
